{
  "version": 1,
  "idempotency_key": "21212121212121212121212121212121",
  "node_id": "66570ff05a2074043084d4aca94293ef067530dde94ff4e92b8d8459253eb779",
  "outcome": "applied",
  "running_generation": 3,
  "instances": [
    "11111111111111111111111111111111"
  ],
  "answered_at_unix_ms": 1791000001200
}
